data,intent
hey me need application for sick take work off on 3 of aug,applyLeave
hey plz I request for medical take work off,applyLeave
please me wish application for sick take work off on 16/11,applyLeave
hello pls request get for maternity vacation on 25 of December,applyLeave
hi plz me wish apply for earned leave,applyLeave
hi I apply for holiday,applyLeave
hello pls I request request for casual leave,applyLeave
hello pls I need application for casual vacation,applyLeave
hi I want get for earned vacation,applyLeave
hi please me need avail for casual leave,applyLeave
hey pls me application for casual vacation on 24th of January,applyLeave
hi plz request request for casual take work off on jun 28,applyLeave
hi plz want request for casual holiday on 26 of June,applyLeave
please wish get for medical take work off on 18 of October,applyLeave
pls me wish request for paternity holiday,applyLeave
hi pls wish avail for maternity holiday on jun 5,applyLeave
hey plz me request get for sick vacation on February 28,applyLeave
plz wish apply for paternity vacation on 30 of july,applyLeave
pls want request for vacation,applyLeave
pls me wish application for take work off,applyLeave
please I request request for sick take work off,applyLeave
need avail for sick vacation,applyLeave
pls me wish get for holiday on 27/6,applyLeave
hey me request request for medical take work off,applyLeave
hey wish avail for casual take work off,applyLeave
application earned leave,applyLeave
plz me request get for paternity leave on 3rd of March,applyLeave
paternity take work off,applyLeave
pls me apply for leave,applyLeave
hello want apply for earned take work off on 27th of mar,applyLeave
hello pls I wish apply for maternity leave on May 17,applyLeave
application paternity take work off,applyLeave
hi plz me need apply for maternity vacation on August 1st,applyLeave
hey plz request application for sick holiday on 28 of dec,applyLeave
hello me application for casual take work off,applyLeave
please me wish get for maternity take work off,applyLeave
hey plz I wish avail for earned take work off,applyLeave
please me request for casual holiday on 9th of December,applyLeave
pls me request request for paternity vacation,applyLeave
hi avail for leave on nov 1,applyLeave
hi pls wish request for sick take work off on 25th of April,applyLeave
hi plz I wish application for earned holiday,applyLeave
plz I request apply for maternity vacation on July 5th,applyLeave
hey pls wish application for sick leave,applyLeave
get casual take work off,applyLeave
hi please avail for paternity holiday,applyLeave
hello plz I wish avail for paternity take work off,applyLeave
hey request application for maternity leave,applyLeave
plz want avail for vacation on jun 25,applyLeave
please apply for casual take work off on 6th of jan,applyLeave
hello me wish request for medical leave on 19th of jan,applyLeave
hello request apply for earned vacation,applyLeave
plz I need avail for sick holiday,applyLeave
hi please I wish avail for holiday on 26 of March,applyLeave
hey pls me request for vacation on oct 7,applyLeave
hi please need request for paternity holiday on 1st of dec,applyLeave
pls I wish apply for paternity leave on 31 of October,applyLeave
hi pls me need get for sick take work off,applyLeave
application medical take work off,applyLeave
hi please application for paternity take work off,applyLeave
please I request request for casual vacation,applyLeave
hello plz me apply for maternity take work off on jun 14,applyLeave
hi pls I request for sick leave,applyLeave
hey plz me need get for earned take work off,applyLeave
please I want application for earned vacation,applyLeave
hi please get for medical leave,applyLeave
plz wish request for earned holiday,applyLeave
plz I get for maternity vacation,applyLeave
hey pls I wish apply for earned vacation on 19 of aug,applyLeave
hey please want request for paternity holiday,applyLeave
request earned vacation,applyLeave
please wish avail for earned holiday,applyLeave
hi please need avail for vacation on 18th of December,applyLeave
get sick leave,applyLeave
plz me want avail for casual leave,applyLeave
hey plz want avail for sick take work off on oct 21,applyLeave
hi pls I need avail for casual take work off,applyLeave
hi wish get for vacation,applyLeave
apply maternity take work off,applyLeave
hey pls me get for medical vacation on feb 9,applyLeave
hey need avail for maternity leave on july 23,applyLeave
hello plz I need avail for casual holiday on 29/5,applyLeave
hello me want avail for maternity leave on 27/11,applyLeave
hey pls I need apply for leave on 9th of April,applyLeave
hello pls I wish get for sick vacation,applyLeave
hi plz request request for earned leave on March 6,applyLeave
hello plz I wish request for earned leave,applyLeave
hi please apply for sick vacation on 24 of nov,applyLeave
hi please me avail for vacation on 8th of sept,applyLeave
apply earned leave,applyLeave
hi pls want avail for sick take work off on 2nd of July,applyLeave
medical leave,applyLeave
hello request request for sick take work off on June 16,applyLeave
hello please avail for medical vacation on July 6th,applyLeave
hi need request for sick take work off,applyLeave
get sick take work off,applyLeave
casual leave,applyLeave
hi pls need apply for casual leave on 13 of july,applyLeave
hi please get for take work off,applyLeave
hey me wish request for leave on 13th of july,applyLeave
apply paternity leave,applyLeave
hi pls me request apply for vacation,applyLeave
hello I request application for maternity holiday,applyLeave
plz want request for medical vacation,applyLeave
hey me want avail for paternity leave on March 17,applyLeave
hi pls me request avail for casual leave on 16 of October,applyLeave
hello plz need request for leave,applyLeave
plz I wish avail for holiday,applyLeave
hey pls I want avail for maternity leave,applyLeave
pls me want avail for maternity leave on 8 of January,applyLeave
plz need apply for leave on March 18th,applyLeave
hi please me avail for earned take work off on 9/8,applyLeave
hello pls I need application for casual holiday,applyLeave
hello please avail for medical holiday on 14th of sept,applyLeave
hey request request for paternity holiday,applyLeave
hello pls I get for sick take work off,applyLeave
hi I wish apply for earned holiday on 5th of September,applyLeave
please me request avail for maternity take work off on 16th of feb,applyLeave
get maternity holiday,applyLeave
application maternity holiday,applyLeave
please I avail for holiday on 7th of may,applyLeave
hey please I request application for maternity leave,applyLeave
hello please avail for medical vacation on 16/7,applyLeave
hi pls I want request for medical vacation on mar 27th,applyLeave
hey I need request for casual leave on 25 of March,applyLeave
me request request for vacation on 31 of May,applyLeave
hi pls me apply for sick holiday on 5th of August,applyLeave
hello plz I wish application for maternity leave on oct 4,applyLeave
hey pls I request get for sick holiday on 20th of jun,applyLeave
hello I need request for paternity vacation,applyLeave
pls apply for paternity leave,applyLeave
hi I apply for medical take work off on 31 of February,applyLeave
hey please I need request for paternity leave on jan 30th,applyLeave
hello please I want request for leave,applyLeave
please me need apply for vacation,applyLeave
hi pls I wish apply for holiday,applyLeave
avail paternity vacation,applyLeave
hey pls me request get for paternity take work off on may 12th,applyLeave
hey need application for sick leave,applyLeave
hello please application for maternity vacation on 8/4,applyLeave
hi plz me need get for casual leave on 9/2,applyLeave
hello please me get for paternity vacation on oct 12,applyLeave
hi pls need application for medical vacation,applyLeave
hi plz I request avail for leave on nov 9,applyLeave
hi please I want apply for paternity take work off,applyLeave
plz me want application for take work off,applyLeave
plz I need application for medical take work off on nov 26th,applyLeave
plz I request application for casual leave on 23 of September,applyLeave
hello plz me wish application for maternity take work off on March 25,applyLeave
hey pls need avail for maternity take work off,applyLeave
hey I request request for paternity holiday on 17/7,applyLeave
please request get for paternity take work off,applyLeave
hello please me request for casual leave,applyLeave
hi plz I request avail for maternity take work off on 15 of feb,applyLeave
hey please me wish application for paternity take work off,applyLeave
application holiday,applyLeave
hey pls me want application for paternity leave on 6/12,applyLeave
hello I wish apply for medical leave,applyLeave
earned holiday,applyLeave
hi please I wish request for paternity holiday on May 4th,applyLeave
hello I need apply for earned take work off,applyLeave
hello plz me need request for casual take work off,applyLeave
hi pls I request application for earned holiday on 16 of August,applyLeave
hi me want apply for medical take work off,applyLeave
avail for casual leave,applyLeave
hello please me application for maternity leave on 21th of November,applyLeave
hey plz me request get for earned take work off on 8 of November,applyLeave
need application for paternity take work off on 8/8,applyLeave
hey please request for maternity vacation,applyLeave
hi pls I get for medical leave on mar 24th,applyLeave
hello plz me request apply for maternity holiday,applyLeave
hi plz me need application for maternity holiday on apr 15,applyLeave
pls me want request for paternity holiday,applyLeave
hello plz wish get for earned holiday on nov 23,applyLeave
hello plz wish application for sick holiday,applyLeave
I request for maternity leave,applyLeave
plz I want request for casual vacation,applyLeave
please wish apply for sick take work off on 20/9,applyLeave
please get for medical vacation on oct 9th,applyLeave
pls I want apply for paternity leave,applyLeave
hey pls I request application for earned leave on nov 26,applyLeave
hey pls request avail for sick leave,applyLeave
wish application for medical leave,applyLeave
pls I wish apply for take work off on 22/1,applyLeave
need request for sick take work off,applyLeave
hey me wish application for take work off,applyLeave
please I request get for paternity leave on sept 14th,applyLeave
hello please I wish request for earned holiday,applyLeave
hey plz I want get for sick leave on feb 16,applyLeave
I wish get for maternity vacation on May 19th,applyLeave
request casual take work off,applyLeave
plz me request get for sick leave,applyLeave
hey pls I wish avail for earned take work off,applyLeave
hi avail for maternity vacation on February 27,applyLeave
hey plz me wish get for earned leave,applyLeave
please I request application for casual holiday on 12 of April,applyLeave
hello pls get for vacation,applyLeave
hey request for paternity take work off on August 23th,applyLeave
hello I want avail for maternity take work off,applyLeave
request sick vacation,applyLeave
hello pls me wish avail for sick holiday on February 6,applyLeave
please need get for casual vacation on 19th of August,applyLeave
hi plz I want request for medical leave,applyLeave
hello pls me wish apply for maternity holiday on 16 of sept,applyLeave
hey please wish request for maternity take work off on 20th of july,applyLeave
hi pls I want apply for sick take work off,applyLeave
application take work off,applyLeave
hey want application for maternity holiday on 16th of apr,applyLeave
hi please me wish avail for sick take work off,applyLeave
avail paternity take work off,applyLeave
hi plz request for casual take work off,applyLeave
hi please me want get for paternity holiday on 8 of October,applyLeave
hey need request for sick leave,applyLeave
hey wish application for sick vacation,applyLeave
hey pls wish apply for medical vacation,applyLeave
me need request for sick holiday on 28 of October,applyLeave
hi please me want request for medical take work off on 24th of sept,applyLeave
please I need application for sick leave,applyLeave
please me wish request for sick vacation on 2nd of May,applyLeave
I want application for earned leave on 14/6,applyLeave
pls apply for sick leave on January 18,applyLeave
hello pls wish apply for medical vacation on jan 23,applyLeave
hello pls I want apply for sick holiday on 2nd of aug,applyLeave
hi me want avail for maternity take work off on 11 of November,applyLeave
I need application for earned take work off,applyLeave
hello plz I application for casual take work off on 23 of oct,applyLeave
hi me want request for maternity take work off,applyLeave
hi plz wish avail for take work off on 3/6,applyLeave
hi me wish request for holiday,applyLeave
me request request for medical take work off,applyLeave
me want application for paternity holiday,applyLeave
please avail for medical vacation,applyLeave
hello plz request apply for medical holiday on 12th of mar,applyLeave
plz me avail for casual leave,applyLeave
hey please need application for earned leave,applyLeave
hi need avail for maternity vacation on May 25,applyLeave
want apply for sick leave,applyLeave
hey pls I request avail for maternity take work off on 17 of apr,applyLeave
hello pls me request application for paternity vacation on july 28,applyLeave
hi plz me want apply for paternity vacation,applyLeave
me wish apply for casual vacation on 17 of July,applyLeave
get medical vacation,applyLeave
me get for paternity take work off on May 14th,applyLeave
apply sick holiday,applyLeave
hey I need avail for casual leave,applyLeave
hey please need avail for medical leave on 3 of November,applyLeave
hi please I want get for maternity take work off,applyLeave
hey plz I request request for paternity holiday on August 26,applyLeave
hey please I request apply for paternity take work off,applyLeave
please I need get for medical leave,applyLeave
hi request application for medical holiday on 25 of nov,applyLeave
plz I application for sick vacation on 10th of February,applyLeave
hi pls wish avail for holiday,applyLeave
hi plz I wish apply for vacation,applyLeave
hello plz wish request for maternity take work off on may 17,applyLeave
hello I request avail for take work off on 8/5,applyLeave
hey me request application for casual take work off on February 22,applyLeave
hey please I need avail for earned take work off,applyLeave
hey please need avail for earned take work off on 14th of October,applyLeave
hi pls request apply for casual take work off,applyLeave
hi pls me need get for earned leave,applyLeave
please me wish application for earned vacation,applyLeave
hey please get for earned holiday on September 19,applyLeave
plz I want avail for maternity take work off on 9/6,applyLeave
hi pls I request get for earned leave,applyLeave
hi pls I wish request for earned holiday,applyLeave
hey pls I avail for vacation,applyLeave
hello pls request request for paternity vacation on feb 2nd,applyLeave
hey plz want request for sick leave on 19th of August,applyLeave
pls want get for vacation on 22th of December,applyLeave
hello please I request avail for paternity vacation,applyLeave
pls me request request for maternity leave,applyLeave
pls I need request for holiday,applyLeave
hey pls I need apply for maternity take work off on apr 2,applyLeave
hi avail for paternity vacation on September 8th,applyLeave
hey please wish apply for paternity vacation on 18 of March,applyLeave
apply medical take work off,applyLeave
pls want get for sick vacation on 30th of May,applyLeave
hi me wish avail for casual take work off on jun 7th,applyLeave
hello plz I avail for paternity vacation,applyLeave
hey pls I wish avail for earned vacation on August 1st,applyLeave
plz application for leave,applyLeave
I wish get for maternity take work off on December 27th,applyLeave
please me wish application for casual take work off on 11th of jan,applyLeave
hello please I request request for casual holiday on 31th of September,applyLeave
hi please I need apply for earned take work off on 20/8,applyLeave
hi plz me request avail for casual holiday on 27/11,applyLeave
pls I want application for earned take work off,applyLeave
hey plz I wish apply for sick leave on 27 of March,applyLeave
I request application for maternity vacation on 16 of October,applyLeave
me want avail for casual vacation,applyLeave
hello please me wish get for casual vacation on apr 19th,applyLeave
hey pls me application for medical vacation,applyLeave
plz I need apply for paternity vacation,applyLeave
hi plz I want get for earned leave,applyLeave
hello pls I need apply for maternity take work off,applyLeave
hey plz me get for maternity holiday,applyLeave
apply paternity take work off,applyLeave
hello pls request get for sick take work off,applyLeave
hi I request avail for maternity vacation,applyLeave
hi plz I wish avail for maternity leave,applyLeave
hello me want apply for earned vacation on may 28th,applyLeave
please me request for medical take work off on 1/5,applyLeave
hello I need request for maternity leave on 27/1,applyLeave
hi please me want avail for earned holiday on aug 7th,applyLeave
hi I wish avail for earned leave on 27th of November,applyLeave
please I wish apply for medical holiday,applyLeave
hey me need get for paternity vacation,applyLeave
hi please me get for sick vacation on 11th of apr,applyLeave
hi please me want apply for medical leave on 30th of may,applyLeave
hello please me need get for medical holiday on jun 14,applyLeave
plz me apply for leave,applyLeave
me request get for casual leave,applyLeave
hi I request request for sick take work off,applyLeave
hi pls request for earned holiday on 8th of May,applyLeave
hi wish get for maternity vacation,applyLeave
hello plz me want application for maternity holiday on 5th of March,applyLeave
hey pls request application for casual leave on 28 of July,applyLeave
hello plz me need avail for earned vacation,applyLeave
pls I need request for maternity holiday on September 12,applyLeave
pls me need apply for sick vacation on 2nd of oct,applyLeave
hi request get for sick leave,applyLeave
hey pls request application for medical holiday,applyLeave
plz me need request for maternity take work off on aug 15th,applyLeave
hi please I want get for medical holiday on 4th of apr,applyLeave
hi request get for maternity vacation on next Wednesday,applyLeave
I wish avail for earned leave on 29 of December,applyLeave
hi pls me request application for sick leave on 2 of March,applyLeave
hey plz wish request for holiday on February 21th,applyLeave
hi pls I want avail for casual holiday on 22/5,applyLeave
hi plz I need application for casual vacation on 18/6,applyLeave
hey me apply for casual leave on aug 6,applyLeave
please need request for maternity leave,applyLeave
hi please me request for paternity vacation,applyLeave
please me request apply for leave on 16 of July,applyLeave
hey pls me want apply for casual take work off,applyLeave
sick vacation,applyLeave
hello please I request for paternity take work off on January 8th,applyLeave
pls request application for medical vacation on july 30,applyLeave
pls I request avail for earned take work off on December 26,applyLeave
application maternity vacation,applyLeave
hey me want request for maternity take work off on jun 30th,applyLeave
hey plz application for earned take work off,applyLeave
hi plz me want apply for medical vacation on 26 of july,applyLeave
hey me wish application for medical leave on 14/4,applyLeave
hey please I wish get for maternity vacation,applyLeave
hi pls me wish application for sick leave,applyLeave
hello plz me request application for maternity take work off,applyLeave
hi please avail for maternity take work off,applyLeave
hi pls me need request for casual vacation,applyLeave
pls me request application for sick take work off,applyLeave
hey please I need get for holiday,applyLeave
hello I want apply for earned vacation,applyLeave
apply medical vacation,applyLeave
hey please me need apply for vacation,applyLeave
hello please wish apply for casual holiday,applyLeave
please get for vacation on 13th of may,applyLeave
hi plz need avail for paternity holiday,applyLeave
hello please wish avail for sick holiday,applyLeave
hello pls need get for maternity holiday on jan 16,applyLeave
hey plz me want application for leave,applyLeave
I want application for casual take work off on 7th of July,applyLeave
hey please apply for take work off,applyLeave
hello plz I request apply for paternity holiday,applyLeave
pls me request request for earned vacation on dec 12,applyLeave
hi plz I apply for sick holiday on 2 of aug,applyLeave
plz me request request for sick take work off,applyLeave
hi pls me want get for sick vacation,applyLeave
want application for casual take work off on july 25th,applyLeave
hey want application for leave,applyLeave
hi please wish application for medical leave,applyLeave
hi pls I wish avail for earned leave on 8th of November,applyLeave
hi please I request application for take work off,applyLeave
hi pls me need get for maternity leave,applyLeave
hey plz need avail for casual holiday,applyLeave
apply medical leave,applyLeave
hi please I wish get for maternity vacation,applyLeave
hey please wish get for casual take work off on September 16,applyLeave
hello pls I need application for maternity take work off on feb 21th,applyLeave
hello pls I need request for earned holiday on 3rd of September,applyLeave
hey get for maternity take work off,applyLeave
hello please I need apply for maternity vacation,applyLeave
pls I application for maternity holiday on May 7th,applyLeave
please I application for casual vacation,applyLeave
hey please need apply for sick vacation on 17th of June,applyLeave
hello pls I apply for medical vacation on November 26,applyLeave
hey plz wish avail for casual leave on 22 of July,applyLeave
plz wish application for casual leave on 22th of jan,applyLeave
hey please request avail for paternity take work off on 1st of mar,applyLeave
I wish application for paternity leave on July 7th,applyLeave
hey pls I wish request for paternity holiday on oct 19,applyLeave
hey please I want request for sick vacation on 17/8,applyLeave
hey plz I wish get for medical take work off,applyLeave
hi pls I need application for medical holiday,applyLeave
hey please me want application for medical take work off on oct 16,applyLeave
hello please want avail for medical take work off,applyLeave
pls me wish application for earned vacation,applyLeave
hi me want get for earned leave on January 3rd,applyLeave
hello me request get for casual take work off on jun 3rd,applyLeave
hi I application for take work off on May 15,applyLeave
hey please get for maternity take work off on 28th of February,applyLeave
me application for casual take work off on 5th of January,applyLeave
plz wish request for paternity leave,applyLeave
hi request apply for sick holiday on January 31th,applyLeave
hi please me need apply for sick vacation,applyLeave
pls need apply for casual vacation on 9th of may,applyLeave
application medical holiday,applyLeave
hi please need request for casual holiday on oct 14,applyLeave
hi plz I request request for earned leave on sept 22,applyLeave
hi get for paternity take work off,applyLeave
hello me need apply for casual holiday on 24/9,applyLeave
pls wish get for take work off,applyLeave
hi pls need apply for medical take work off on 14 of October,applyLeave
need avail for sick take work off on july 23,applyLeave
hi pls I need request for take work off on 21 of August,applyLeave
hi pls wish request for earned vacation on 10 of oct,applyLeave
plz I get for casual leave,applyLeave
hello please I want application for earned holiday,applyLeave
hey me want apply for paternity vacation on March 19,applyLeave
hey plz me wish application for earned take work off,applyLeave
hello plz me want request for maternity holiday,applyLeave
hey pls need get for maternity take work off on 18 of feb,applyLeave
hey pls me get for vacation on feb 7,applyLeave
hey pls me request request for paternity holiday on 19/2,applyLeave
hi pls get for paternity vacation on 6th of November,applyLeave
hey please me want avail for paternity take work off,applyLeave
please wish request for maternity leave on feb 16,applyLeave
plz avail for sick vacation on may 4th,applyLeave
hey please need application for earned holiday on oct 5,applyLeave
hey plz me get for paternity vacation on 30 of May,applyLeave
hello want avail for holiday,applyLeave
hello pls avail for maternity holiday on 17th of jun,applyLeave
hello plz me need apply for sick vacation on 13 of July,applyLeave
hey please request for sick vacation,applyLeave
hey me wish request for sick holiday,applyLeave
hi pls I need get for medical take work off,applyLeave
hey pls need apply for medical take work off,applyLeave
avail casual take work off,applyLeave
hello please me application for sick holiday,applyLeave
hi pls need get for earned holiday on July 12th,applyLeave
please me request application for maternity holiday,applyLeave
hello plz I avail for leave,applyLeave
pls me request get for maternity holiday on 31/5,applyLeave
hello I apply for casual vacation on January 3rd,applyLeave
please me wish apply for earned take work off on july 7th,applyLeave
hello plz wish avail for sick leave,applyLeave
hello pls application for medical vacation,applyLeave
hey plz me want application for casual take work off on jan 1,applyLeave
