data,intent
hello greetings,greet
hey good morning whatsup,greet
hey,greet
good morning sup,greet
hi whatsup,greet
hey good day how are you,greet
hi,greet
hello good afternoon,greet
hello good night,greet
hi good day are you around?,greet
hi good morning how is it going,greet
hello greetings are you around?,greet
greetings are you around?,greet
hey good day are you there,greet
hey are you there,greet
hey morning how are things going,greet
morning are you around?,greet
hello good morning are you around,greet
hi good morning,greet
greetings whatsup,greet
hey greetings are you around,greet
hey good night sup,greet
hey good morning,greet
hey greetings are you there,greet
hello,greet
hi how are you,greet
hi good night,greet
hi morning how are things going,greet
good day sup,greet
good morning are you around,greet
greetings how are you,greet
hello are you there,greet
hello good night are you around?,greet
good afternoon whatsup,greet
hi good afternoon,greet
hello whats up,greet
hi greetings are you there,greet
hi morning are you around,greet
hello good day whatsup,greet
good night how are things going,greet
hey good day whatsup,greet
good morning how are things going,greet
hi how are things going,greet
hey morning,greet
hello morning,greet
hey good day sup,greet
hey are you around?,greet
hi good morning are you around,greet
hey morning are you around,greet
hi good afternoon whatsup,greet
chao,bye
leaving gtg,bye
leaving bye,bye
thank you chau,bye
heading out ttyl,bye
chao thanks,bye
have to go bye,bye
adios thank you,bye
thank you gtg,bye
got to go adios,bye
adieu,bye
leaving chao,bye
thanks chau,bye
farewell,bye
adios thanks,bye
adieu thank you,bye
heading out gtg,bye
adios,bye
thank you adios,bye
chau,bye
im leaving now adios,bye
talk to you soon farewell,bye
heading out bye,bye
talk to you later bye,bye
heading out adieu,bye
talk to you soon bye,bye
heading out chao,bye
im leaving now bye,bye
bye,bye
im leaving now goodbye,bye
going out ttyl,bye
talk to you later chao,bye
chao thank you,bye
im leaving now farewell,bye
thank you farewell,bye
thanks bye,bye
im leaving now gtg,bye
got to go farewell,bye
got to go goodbye,bye
heading out adios,bye
farewell thanks,bye
talk to you soon goodbye,bye
thanks adieu,bye
have to go chao,bye
talk to you later farewell,bye
thank you chao,bye
going out bye,bye
heading out chau,bye
going out adieu,bye
have to go gtg,bye
yes that is what i want agreed,affirmative
its fine im ok with that,affirmative
affirmative that is good,affirmative
yes i want that yes sir,affirmative
yes its fine correct,affirmative
that is fine,affirmative
correct that is what i want right,affirmative
yes that is right affirmative,affirmative
affirmative you understood me,affirmative
agreed im ok with that,affirmative
yes sir pls,affirmative
yes sir,affirmative
yes i want that yes,affirmative
right agreed thank you,affirmative
right please,affirmative
agreed yep thanks,affirmative
sounds good that is correct sounds good,affirmative
yep yes sir thank you,affirmative
its fine yes,affirmative
that is right,affirmative
correct you understood me im ok with that,affirmative
right,affirmative
yes sir correct thank you,affirmative
im ok with that that is fine yes,affirmative
that is correct agreed,affirmative
sounds good its fine sounds good,affirmative
correct,affirmative
sounds good sounds good,affirmative
sounds good i want that yes sir,affirmative
sounds good you understood me yes sir,affirmative
yes yes,affirmative
right thanks,affirmative
yes sir you understood me affirmative,affirmative
affirmative you understood me sounds good,affirmative
right that is what i want yes,affirmative
im ok with that yep,affirmative
yep,affirmative
correct i want that agreed,affirmative
agreed sounds good thanks,affirmative
right that is correct yep,affirmative
yes sir i want that im ok with that,affirmative
im ok with that im ok with that thank you,affirmative
right that is correct affirmative,affirmative
agreed,affirmative
agreed sounds good thank you,affirmative
agreed thanks,affirmative
affirmative im ok with that thank you,affirmative
affirmative i want that right,affirmative
that is correct yes,affirmative
yes that is good yes,affirmative
not really that's not correct,negative
plz not really dont mean that,negative
i don't want that,negative
that's wrong,negative
that's not right its not correct,negative
please incorrect,negative
that's not right,negative
please that's not right that's wrong,negative
that's not what i want,negative
please nope it's not good,negative
incorrect,negative
don't do that,negative
that is wrong,negative
no plz,negative
please nope dont mean that,negative
no pls that's not correct,negative
plz no its not ok,negative
it's not good,negative
please that's not right that's not what i want,negative
not really that's not what i want,negative
don't do that please its not correct,negative
no pls,negative
nope that's wrong,negative
plz that's not right that's not what i want,negative
pls that's not right didnt meant that,negative
plz incorrect that's not correct,negative
not really,negative
please that's not right dont mean that,negative
pls don't do that it's not good,negative
please don't do that that's not what i want,negative
pls incorrect that is wrong,negative
please not really its not correct,negative
not really that's wrong,negative
nope plz it's not good,negative
please no,negative
please nope,negative
plz that's not right i don't want that,negative
that's not correct,negative
incorrect plz its not ok,negative
that's not right please didnt meant that,negative
that's not right please that's wrong,negative
that's not right that's not correct,negative
incorrect pls that's wrong,negative
no pls that's wrong,negative
its not correct,negative
pls incorrect it's not good,negative
not really plz didnt meant that,negative
plz not really that's not what i want,negative
don't do that pls its not ok,negative
its not ok,negative
reserve available room from 6:57 to 7:09 am on nov 7,bookMeeting
schedule some available room,bookMeeting
show available meeting between 0:38 am and 11:6,bookMeeting
search any available meet,bookMeeting
identify meeting between 21:46 and 3:4 am,bookMeeting
reserve available meet from 2:22 to 3:7 am on 5 of November,bookMeeting
look for some available meet on 1 of July,bookMeeting
setup available meet from 0:08 pm to 3:38 on 27/1,bookMeeting
look for all available meet,bookMeeting
arrange available meet,bookMeeting
reserve meet from 2:9 to 8 am on 8th of June,bookMeeting
schedule room from 6:1 to 2:0 on January 10th,bookMeeting
book available room,bookMeeting
arrange any available hall,bookMeeting
arrange any meeting,bookMeeting
arrange available meet from 7:4 am to 7:26 on August 29,bookMeeting
fix any available hall,bookMeeting
identify available meet on dec 20th,bookMeeting
show all available meet between 11:09 and 10:14 pm,bookMeeting
setup some meet,bookMeeting
setup all available meeting,bookMeeting
book meet from 4:02 to 8:51,bookMeeting
show any available hall between 16:38 and 1:19,bookMeeting
fix hall from 7:43 to 4:50 am on 6 of November,bookMeeting
book some room,bookMeeting
show me any meet between 10:00 pm and 14:15,bookMeeting
schedule any meet,bookMeeting
identify available meet,bookMeeting
schedule all meeting,bookMeeting
book room,bookMeeting
show me any hall between 7:18 and 9:8 pm,bookMeeting
find all available meeting,bookMeeting
search some available meeting,bookMeeting
search all available meet between 15:44 and 19:08,bookMeeting
show any hall on 4 of December,bookMeeting
show some available meeting,bookMeeting
find available room on 24th of January,bookMeeting
show me any available meeting between 18:00 and 2:06 pm,bookMeeting
book all meeting,bookMeeting
show any available meet on 18th of oct,bookMeeting
setup meeting from 1:22 to 15:21 on jun 9th,bookMeeting
book room from 9:23 pm to 1:31,bookMeeting
show some available meeting between 9:43 and 5:53 pm,bookMeeting
arrange hall from 22:17 to 9:29 pm on 1 of May,bookMeeting
setup all meeting,bookMeeting
book meeting from 8:57 to 9:17 pm on 20 of mar,bookMeeting
fix available hall from 7:27 pm to 6:05 pm on July 1,bookMeeting
book room from 9:16 am to 0:42 pm on 7 of jan,bookMeeting
find available meeting,bookMeeting
find all available hall between 10:20 am and 5:2 pm,bookMeeting
show any meeting between 0:30 and 2:55 am,bookMeeting
schedule room from 1:49 to 8:21 on feb 17,bookMeeting
fix some room,bookMeeting
schedule available meet from 11:17 to 12:5,bookMeeting
setup any meeting,bookMeeting
fix meet from 1:19 pm to 8:44,bookMeeting
setup meet from 11:34 am to 11:1 am on oct 29,bookMeeting
setup hall,bookMeeting
book meeting from 4:54 to 13:5 on sept 16,bookMeeting
fix meeting from 0:45 to 2:33,bookMeeting
find available hall on july 21,bookMeeting
identify any room on 10 of May,bookMeeting
book meeting from 9:11 to 5:49 on 28 of jan,bookMeeting
reserve available room from 4:15 to 2:56 on 21 of July,bookMeeting
fix meeting from 8:4 to 4:37 am,bookMeeting
arrange available meet from 8:05 am to 4:28 pm,bookMeeting
show me any room on 20/6,bookMeeting
look for any available meeting,bookMeeting
look for some available meet,bookMeeting
arrange available meet from 2:7 pm to 3:19,bookMeeting
setup any available hall,bookMeeting
arrange hall from 10:27 am to 11:14,bookMeeting
search available meet,bookMeeting
schedule hall from 7:42 pm to 0:30 pm,bookMeeting
show some meet on 31 of nov,bookMeeting
search all available meet,bookMeeting
arrange room from 5:47 to 6:00 on August 2nd,bookMeeting
find all available hall,bookMeeting
schedule meeting from 8:15 to 5:10 on 9/12,bookMeeting
identify some available room,bookMeeting
schedule meet from 9:22 to 8:18 on 5th of December,bookMeeting
arrange available hall from 11 to 6:55 pm on 5th of sept,bookMeeting
arrange available meeting from 10:13 to 11:8,bookMeeting
reserve available hall from 3:24 to 4:30 on 3rd of nov,bookMeeting
schedule available hall from 17:19 to 0:19 am,bookMeeting
look for meeting between 8:32 and 10:51 pm,bookMeeting
find some available meeting on 26/5,bookMeeting
show meet on 17 of May,bookMeeting
arrange some hall,bookMeeting
reserve meeting from 12:51 to 9:53,bookMeeting
schedule available room from 0:36 to 3:29 on 14 of January,bookMeeting
schedule meet from 10:24 to 13:15 on jan 13th,bookMeeting
look for all available room,bookMeeting
reserve available room from 7:51 am to 22:50 on 19 of may,bookMeeting
show any available room between 2:25 am and 6:19,bookMeeting
identify some available meeting on nov 11,bookMeeting
reserve some available meet,bookMeeting
reserve available meet from 1:53 to 5:33 am on 12th of may,bookMeeting
arrange any available room,bookMeeting
fix available room from 1:1 to 12:2 on 18th of feb,bookMeeting
show me some available meet on 7 of mar,bookMeeting
arrange meeting from 5:41 am to 8:1 on 22/3,bookMeeting
fix available meeting from 2:58 to 2:53 am on nov 18,bookMeeting
look for any room on 20th of july,bookMeeting
reserve available meeting from 8:12 pm to 20:4,bookMeeting
reserve available hall from 1:02 to 8:06 pm,bookMeeting
setup hall from 0:49 pm to 17:51 on dec 23th,bookMeeting
setup meet from 0:13 to 6:38 on 9 of September,bookMeeting
schedule some available hall,bookMeeting
search any available meeting,bookMeeting
arrange some room,bookMeeting
look for some available meeting,bookMeeting
show me any meet on jan 4,bookMeeting
reserve meet from 1:42 to 9:24 on October 3,bookMeeting
look for meeting between 2:57 am and 6:36,bookMeeting
arrange meeting from 9:0 am to 1:43 am on jun 23th,bookMeeting
reserve meeting from 7:44 to 15:21,bookMeeting
find available meeting on jun 4th,bookMeeting
find some available room,bookMeeting
show me any meeting on 13th of may,bookMeeting
search any available room between 4:58 and 14:52,bookMeeting
identify any available meet between 7:07 pm and 10:38,bookMeeting
reserve any room,bookMeeting
find all available hall between 20:42 and 4:1 pm,bookMeeting
look for any available room on 26/9,bookMeeting
identify some meeting between 10:28 pm and 11:0 pm,bookMeeting
show some available meeting between 8:00 am and 19:2,bookMeeting
show all hall between 18:22 and 0:52 pm,bookMeeting
schedule any available hall,bookMeeting
look for any available room,bookMeeting
schedule some available meeting,bookMeeting
show me all available meet,bookMeeting
schedule room from 17:7 to 8:59,bookMeeting
look for hall on 6/6,bookMeeting
arrange room from 8:0 am to 5:16 am on 24/4,bookMeeting
arrange available meeting from 10:8 am to 18:19,bookMeeting
find some meet between 1:40 pm and 3:02 am,bookMeeting
reserve meet from 11:35 to 4:11,bookMeeting
look for some meeting between 14:2 and 11:26,bookMeeting
fix available meeting from 9:18 to 22:36 on 2 of August,bookMeeting
identify some meet on jan 6,bookMeeting
book meet from 5:43 am to 7:6 pm,bookMeeting
arrange available meet from 5:43 am to 2:45,bookMeeting
show me any available meeting,bookMeeting
schedule room,bookMeeting
book meeting,bookMeeting
identify all available room,bookMeeting
fix available room from 0:5 am to 6:23 pm on 13 of nov,bookMeeting
book available meeting from 15:06 to 2:09,bookMeeting
show any available meeting,bookMeeting
setup available meeting from 8:7 pm to 23:35 on 3 of oct,bookMeeting
show me any available meet,bookMeeting
schedule meet from 10:24 to 15:30,bookMeeting
search all available hall on August 8th,bookMeeting
fix available meeting from 4:0 pm to 19:17 on 18th of july,bookMeeting
search any available meeting between 22:14 and 16:06,bookMeeting
reserve available room from 9:52 to 17:59 on January 16,bookMeeting
fix all available meet,bookMeeting
find hall on 25th of April,bookMeeting
search any meet between 14:25 and 0:38 am,bookMeeting
find any room on February 31,bookMeeting
show all available room,bookMeeting
find available hall,bookMeeting
reserve available meet from 1:27 to 10:30 am on 1 of mar,bookMeeting
reserve meeting from 7:44 to 3:20 pm,bookMeeting
fix available hall from 19:43 to 13:24 on 18 of July,bookMeeting
reserve meeting,bookMeeting
identify any available meeting,bookMeeting
reserve available room from 0:54 pm to 9:03,bookMeeting
fix available meeting,bookMeeting
identify some room between 11:11 and 10:23,bookMeeting
search some available room between 8:25 am and 19:32,bookMeeting
arrange meeting from 1:29 pm to 16:19,bookMeeting
look for any hall on 27 of apr,bookMeeting
reserve hall from 5:23 am to 0:54 pm on 13 of july,bookMeeting
identify all available room on 1st of apr,bookMeeting
fix available room from 6:28 to 13:19 on 13th of aug,bookMeeting
setup available meet from 1:04 to 2:22 am,bookMeeting
fix any meeting,bookMeeting
setup available meeting from 3 to 9:55,bookMeeting
find meeting on 26 of aug,bookMeeting
arrange meet from 6:30 pm to 9:03 pm,bookMeeting
show available hall between 2:16 pm and 0:00 am,bookMeeting
arrange available meeting,bookMeeting
arrange available hall,bookMeeting
reserve hall from 10:19 to 7:10 pm on 9/5,bookMeeting
identify any available room between 7:41 am and 3:34 am,bookMeeting
find any available room,bookMeeting
show meet on 9 of july,bookMeeting
arrange hall from 4:10 to 10:16 pm,bookMeeting
show me some available meeting,bookMeeting
show me all hall between 22:58 and 12:3,bookMeeting
fix some meeting,bookMeeting
find all available meeting between 12:19 and 17:24,bookMeeting
fix room from 22:13 to 4:55 on 13/10,bookMeeting
reserve available meeting from 7:58 pm to 7:4 am on 26 of December,bookMeeting
show all available meet on 19/1,bookMeeting
show me all available meet between 14:05 and 0:59,bookMeeting
search any meeting between 4 am and 18:52,bookMeeting
setup meet from 11:22 to 10:01 pm,bookMeeting
look for available meet on 4/9,bookMeeting
look for some available hall,bookMeeting
fix meeting from 17:25 to 2:00 pm on sept 3,bookMeeting
search all meet between 10:38 am and 13:35,bookMeeting
fix room from 17:49 to 14:30,bookMeeting
identify any available hall between 7:56 and 7:15 pm,bookMeeting
find available meeting on December 25,bookMeeting
arrange available hall from 0:39 to 10:59 on 27th of sept,bookMeeting
arrange some available hall,bookMeeting
show any room between 9:5 am and 11:49 pm,bookMeeting
identify any available hall between 11:9 pm and 9:08 am,bookMeeting
fix hall,bookMeeting
search some hall between 12:40 pm and 21:25,bookMeeting
schedule hall,bookMeeting
setup available room from 18:49 to 7:32 pm on March 21th,bookMeeting
fix available meeting from 0:03 to 9:9 pm,bookMeeting
book available hall from 19:39 to 16:22 on 16 of July,bookMeeting
show me available hall,bookMeeting
setup meeting,bookMeeting
schedule available room from 8:11 to 11:59 am,bookMeeting
setup all available meet,bookMeeting
reserve all available meeting,bookMeeting
fix some available room,bookMeeting
look for available meet on March 13,bookMeeting
identify any available hall,bookMeeting
show any room on 14 of mar,bookMeeting
show any available meet,bookMeeting
look for some available room,bookMeeting
fix any available meet,bookMeeting
find all meeting on may 7,bookMeeting
search available hall,bookMeeting
fix meeting,bookMeeting
reserve all available hall,bookMeeting
arrange available hall from 8:47 to 6:53 am on aug 21,bookMeeting
show all meet between 9:36 and 2:17,bookMeeting
fix available room,bookMeeting
schedule room from 16:17 to 9:46,bookMeeting
find available meet,bookMeeting
book available meeting,bookMeeting
search available room on nov 23th,bookMeeting
setup all hall,bookMeeting
identify any meeting on mar 22,bookMeeting
identify any hall between 4:43 pm and 10:31,bookMeeting
setup meeting from 23:45 to 0:58,bookMeeting
book available meeting from 10:52 to 5:42 on 14 of dec,bookMeeting
find all available hall on 2/10,bookMeeting
book available room from 0:2 am to 6:06 am,bookMeeting
book all meet,bookMeeting
fix meeting from 0:58 pm to 2:02 am on july 8th,bookMeeting
setup available meeting from 9:01 pm to 12:04 on 26th of jun,bookMeeting
fix available hall from 8:56 to 16:45 on 21th of July,bookMeeting
setup meeting from 9:19 to 7 pm,bookMeeting
search all available meeting on 27 of feb,bookMeeting
book available meet from 10:06 to 0:43,bookMeeting
schedule available hall from 7:27 am to 7:58 pm on 15th of August,bookMeeting
show some available meeting on oct 30th,bookMeeting
show me available meeting,bookMeeting
schedule meet from 8:14 to 12:45 pm,bookMeeting
search all meeting between 4:49 pm and 11:50,bookMeeting
arrange all meeting,bookMeeting
search all hall on July 4,bookMeeting
look for some available meet on sept 24th,bookMeeting
reserve all meeting,bookMeeting
book available meeting from 1:47 pm to 1:20,bookMeeting
fix meeting from 4:05 am to 15:09,bookMeeting
setup any available room,bookMeeting
show all available meet,bookMeeting
schedule available hall from 11:01 pm to 4:58 am,bookMeeting
fix meeting from 11:24 pm to 5:37,bookMeeting
arrange all room,bookMeeting
show available room,bookMeeting
search all available room,bookMeeting
look for meet between 10:0 am and 9:46,bookMeeting
find hall on 6th of April,bookMeeting
arrange available room from 9:51 am to 5:25 on mar 18,bookMeeting
find some available room between 1:38 am and 4:46 pm,bookMeeting
look for available meet,bookMeeting
fix meet from 5:31 am to 15:0,bookMeeting
search all available hall,bookMeeting
setup available room,bookMeeting
setup available meet from 15:35 to 9:31,bookMeeting
schedule any available meeting,bookMeeting
book room from 3:51 am to 11:57 am,bookMeeting
schedule meet from 5:05 am to 8:42 pm,bookMeeting
search hall between 8:23 am and 8:0,bookMeeting
arrange meet from 3:53 am to 0:09 on next Monday,bookMeeting
search some available hall between 3:41 pm and 8:08 am,bookMeeting
search available room between 5:29 am and 3:24,bookMeeting
reserve available meet from 1:7 pm to 6:2 pm on 3 of oct,bookMeeting
show me any available hall on 13 of feb,bookMeeting
reserve available meeting from 6:18 pm to 2:15 pm on jan 13,bookMeeting
arrange available meeting from 21:04 to 7:08 on 29 of oct,bookMeeting
fix available meeting from 10:19 am to 9:07 pm on jun 15,bookMeeting
show all meeting between 0:58 am and 5:17,bookMeeting
fix some hall,bookMeeting
setup all available room,bookMeeting
arrange available meeting from 0:01 to 2:57 on 28 of may,bookMeeting
find any meet between 7:02 and 6:14 pm,bookMeeting
arrange meeting from 16:56 to 18:05,bookMeeting
book all room,bookMeeting
search all meeting on 10/1,bookMeeting
fix any hall,bookMeeting
book available room from 4:59 pm to 2:43 on 11th of September,bookMeeting
show me all available hall on 22 of March,bookMeeting
setup hall from 12:03 am to 4:0,bookMeeting
show any room on 30th of January,bookMeeting
schedule hall from 2:56 am to 4:55 pm on 11 of oct,bookMeeting
book hall from 11:44 to 2:35 on 1/3,bookMeeting
reserve hall from 8:33 to 20:49,bookMeeting
show me all meet between 1:57 am and 6:47 pm,bookMeeting
schedule hall from 9 to 15:51,bookMeeting
show all available meet between 11:50 and 9:2,bookMeeting
look for all meet on 23 of oct,bookMeeting
fix hall from 13:3 to 10:32 on 20 of mar,bookMeeting
book any hall,bookMeeting
identify any hall between 9:33 and 0:08 pm,bookMeeting
fix meet from 11:34 to 3:39,bookMeeting
schedule some available meet,bookMeeting
find any meet between 11:9 and 12 am,bookMeeting
fix any meet,bookMeeting
book meeting from 4:34 to 8:46,bookMeeting
book all hall,bookMeeting
identify all meet on 2nd of September,bookMeeting
search some available meeting on 25th of may,bookMeeting
fix available meeting from 6:49 am to 16:40 on 9/2,bookMeeting
search some meet on 16/8,bookMeeting
schedule available hall from 1:09 pm to 7:16,bookMeeting
schedule meeting from 1:0 to 0:1 on 8 of sept,bookMeeting
find any available hall between 3:28 pm and 5:39 pm,bookMeeting
book hall,bookMeeting
schedule meeting from 9:54 am to 10:7,bookMeeting
show any meeting on May 18th,bookMeeting
look for available room,bookMeeting
book some available meeting,bookMeeting
identify any room between 6:29 pm and 20:15,bookMeeting
schedule available hall from 1:18 am to 1:03 on jan 17th,bookMeeting
show any available meet between 13:45 and 11:41 am,bookMeeting
book meeting from 11:43 pm to 2:28 on 6th of mar,bookMeeting
setup available meet,bookMeeting
search some meet between 16:45 and 4:7 pm,bookMeeting
search some available hall on aug 21,bookMeeting
find some meeting between 20:3 and 2:38 am,bookMeeting
show all available hall,bookMeeting
schedule available room from 6:37 to 20:08,bookMeeting
book meet from 7:8 am to 6:20 am,bookMeeting
setup available hall from 0:43 am to 1:49 on 29th of November,bookMeeting
book any meeting,bookMeeting
reserve any hall,bookMeeting
book available room from 1:14 am to 8:1 on 8/10,bookMeeting
show any available room between 8:0 am and 10:55,bookMeeting
schedule available meet from 3:39 to 1:05,bookMeeting
find some available meeting on May 28,bookMeeting
show any available room between 11:08 and 0:39,bookMeeting
schedule meeting from 11:1 pm to 20:03 on 1 of August,bookMeeting
setup available meet from 4:53 pm to 3:54,bookMeeting
show me all meeting between 5:46 pm and 5:26,bookMeeting
look for all hall on nov 1,bookMeeting
setup available meet from 9:11 to 13:58 on July 9th,bookMeeting
book any available hall,bookMeeting
search available meeting between 0:40 and 6:44 pm,bookMeeting
setup hall from 1:00 to 8:0 pm,bookMeeting
schedule available meeting,bookMeeting
search any meeting on 22/7,bookMeeting
look for available hall,bookMeeting
book room from 9:18 to 3:30,bookMeeting
setup available room from 7:05 to 3:08 pm,bookMeeting
find available meet on 17/4,bookMeeting
look for some available meeting between 6:30 and 4:43,bookMeeting
setup meeting from 0:51 pm to 23:5,bookMeeting
look for available room between 4:00 pm and 8:16,bookMeeting
find room between 9:20 and 2:04,bookMeeting
identify available hall,bookMeeting
show room on 7/10,bookMeeting
identify available meet on 8th of April,bookMeeting
look for any available meet on 22 of October,bookMeeting
arrange available room from 6:22 pm to 5:08,bookMeeting
book all available meeting,bookMeeting
fix available room from 6:50 pm to 5:01 am on 16th of apr,bookMeeting
schedule available meeting from 0:14 to 4:17,bookMeeting
find all available meet,bookMeeting
setup available meeting from 4:34 to 8:7 pm,bookMeeting
show some available room on June 8,bookMeeting
show available room on December 16,bookMeeting
find available room,bookMeeting
identify some available hall between 3:51 pm and 7:08 am,bookMeeting
schedule room from 14:6 to 14:09,bookMeeting
schedule available room from 20:23 to 2:18 am on June 28,bookMeeting
show me available room between 22:41 and 6:52,bookMeeting
schedule all available room,bookMeeting
fix available hall,bookMeeting
arrange all meet,bookMeeting
show all room on 7th of mar,bookMeeting
look for some available room between 7:37 pm and 22:34,bookMeeting
setup meet from 11:19 to 16:38,bookMeeting
show me all room on july 12th,bookMeeting
arrange available meeting from 9:17 am to 0:36,bookMeeting
identify meeting between 12:6 and 3:55 am,bookMeeting
show me all available hall between 1:44 pm and 5:00,bookMeeting
schedule any hall,bookMeeting
reserve hall from 20:0 to 6:38,bookMeeting
