data,intent
fix available meeting from 7:22 pm to 12:4 pm on 8 of jun,bookMeeting
look for all available meeting on jan 8th,bookMeeting
schedule any available room,bookMeeting
show meeting between 10:49 and 12:54 am,bookMeeting
fix room from 17:2 to 7:39 am,bookMeeting
show me available meet,bookMeeting
reserve all meet,bookMeeting
fix room from 11:40 am to 8:56 on jan 26th,bookMeeting
reserve available hall from 4:20 to 1:1 pm on oct 18,bookMeeting
show me available hall between 23:17 and 4:8,bookMeeting
setup meeting from 10:34 to 13:57,bookMeeting
book room from 0:36 am to 6:12 pm on 30th of February,bookMeeting
identify all available meet,bookMeeting
identify some available room between 2:1 and 12:56 pm,bookMeeting
arrange meet from 9:5 am to 12:51 pm,bookMeeting
look for some available room between 21:33 and 12:09,bookMeeting
show available meeting on 13th of September,bookMeeting
setup available room from 18:45 to 10:33 am on 5 of April,bookMeeting
look for room on 2nd of sept,bookMeeting
setup available hall from 2:15 am to 4:38 on 10 of mar,bookMeeting
show available meet,bookMeeting
find meet between 7:06 am and 7:3 am,bookMeeting
identify all room on 7 of November,bookMeeting
find some meeting on 30th of May,bookMeeting
show any available room,bookMeeting
find some room on 8/3,bookMeeting
show all available meeting,bookMeeting
fix all meeting,bookMeeting
find any hall on 23 of aug,bookMeeting
book available meeting from 2:41 to 17:47 on sept 4,bookMeeting
book hall from 3:26 pm to 10:36,bookMeeting
reserve room from 3:15 to 12:01 pm on aug 22,bookMeeting
setup available meet from 9:7 to 10:4,bookMeeting
schedule hall from 14:23 to 4:50 am on nov 1,bookMeeting
book available meeting from 1:3 to 10:15 on 22th of May,bookMeeting
find some available room on nov 3,bookMeeting
show me available meeting between 0:10 and 9:18 pm,bookMeeting
schedule all available meet,bookMeeting
identify some meeting between 2:11 pm and 5:27,bookMeeting
reserve hall from 21:4 to 4:9 pm,bookMeeting
look for some available meeting between 1:32 and 3:51,bookMeeting
arrange room from 15:58 to 2:4 pm on 3rd of May,bookMeeting
fix room from 11:32 am to 23:35,bookMeeting
book available room from 8 to 5:27 pm,bookMeeting
book meeting from 2:19 to 6:57 pm,bookMeeting
arrange available meet from 10:07 to 1:44,bookMeeting
identify some available hall on 4th of February,bookMeeting
setup available meet from 11:4 to 14:37 on 31th of June,bookMeeting
find room on April 2nd,bookMeeting
look for all meeting on 19th of sept,bookMeeting
search any available hall on july 29th,bookMeeting
arrange available meeting from 6:7 to 1:19 on 15/1,bookMeeting
setup available hall from 7:43 am to 7:28 am,bookMeeting
arrange meet from 4:16 pm to 9:21 on 6/4,bookMeeting
schedule meet from 13:59 to 9:29 on 29 of June,bookMeeting
search some available meeting between 0:59 and 0:06 pm,bookMeeting
look for available room on 19 of jun,bookMeeting
search any available meet on 11 of May,bookMeeting
arrange available meeting from 9:57 to 16:44 on July 2,bookMeeting
arrange hall from 8:17 pm to 1:30 am,bookMeeting
identify hall between 21:39 and 9:22 pm,bookMeeting
schedule hall from 11:33 to 12:33,bookMeeting
schedule available hall from 8:54 to 6:43 pm,bookMeeting
identify some available hall,bookMeeting
show available room on 15 of sept,bookMeeting
arrange all available room,bookMeeting
arrange available meeting from 3:43 to 20:22 on 9 of December,bookMeeting
show me all available hall on 15th of December,bookMeeting
fix available meeting from 11:08 to 9:26 on 17 of oct,bookMeeting
schedule hall from 10:05 pm to 6:03 am on September 2nd,bookMeeting
setup any room,bookMeeting
identify any meeting between 3:41 and 10:17,bookMeeting
fix available meet from 23:27 to 13:8 on June 25,bookMeeting
fix meeting from 14:19 to 11:4 am on 18 of nov,bookMeeting
search some available hall on 2 of December,bookMeeting
book available hall from 6:51 pm to 9:11 am on 24th of nov,bookMeeting
reserve room from 8:42 pm to 9:06 on 4 of September,bookMeeting
show me all available room,bookMeeting
setup hall from 8:31 am to 12:19 on may 3rd,bookMeeting
schedule meeting from 1:30 to 15:42 on 22th of jun,bookMeeting
find all meet on May 19,bookMeeting
schedule available meeting from 12:27 pm to 11:25 am,bookMeeting
show me any available room between 20:45 and 4:40 am,bookMeeting
schedule any meeting,bookMeeting
show me some available hall,bookMeeting
look for any meet between 11:15 am and 13:52,bookMeeting
find all available hall on 6/10,bookMeeting
find all available hall on 14/10,bookMeeting
fix hall from 10:08 am to 0:24,bookMeeting
show meet between 21:54 and 2:25 pm,bookMeeting
schedule some room,bookMeeting
arrange available hall from 2:3 pm to 8:12,bookMeeting
arrange hall from 8:42 to 12:17 pm,bookMeeting
show any available meeting on January 4,bookMeeting
arrange any room,bookMeeting
arrange available meeting from 18:52 to 7:59,bookMeeting
search some available hall,bookMeeting
look for available room on August 26,bookMeeting
identify all available room on 29th of October,bookMeeting
schedule meet from 9:50 to 2:45,bookMeeting
look for any meet between 11:24 am and 21:02,bookMeeting
schedule meeting from 23:9 to 1:27 on sept 21th,bookMeeting
reserve available hall from 23:50 to 1:39,bookMeeting
reserve meeting from 3:59 am to 1:21 am,bookMeeting
book hall from 2:37 to 10:8 on apr 18th,bookMeeting
look for available meeting on 13 of August,bookMeeting
search room on 2nd of July,bookMeeting
find any available meet,bookMeeting
identify meeting between 10:46 pm and 18:43,bookMeeting
book hall from 12:07 pm to 0:55 am,bookMeeting
schedule room from 5:8 to 6:55 pm,bookMeeting
identify any available meet,bookMeeting
schedule available hall from 1:09 pm to 2:49 am,bookMeeting
schedule available meet,bookMeeting
book room from 7:21 to 7:30,bookMeeting
look for some available hall on 13 of mar,bookMeeting
show me any room on 26th of jan,bookMeeting
show all meet on feb 12th,bookMeeting
show any available meeting on 30 of july,bookMeeting
schedule room from 9 am to 12:9 pm,bookMeeting
show me some available room between 9:52 and 8:0 pm,bookMeeting
look for available room on July 12th,bookMeeting
reserve all room,bookMeeting
search some meet between 23:26 and 4:33,bookMeeting
search some available meeting on 1st of feb,bookMeeting
look for any meet between 4:44 am and 20:26,bookMeeting
fix available hall from 2:36 am to 11:05 on December 10,bookMeeting
schedule meeting from 7:31 am to 9 on 3 of November,bookMeeting
setup available hall from 15:48 to 9:36 on mar 29th,bookMeeting
identify any available meeting between 8:41 and 14:28,bookMeeting
book available hall from 5:08 am to 14:46,bookMeeting
show all available meet on dec 6th,bookMeeting
setup available room from 13:04 to 0:00 on 15 of jan,bookMeeting
fix meet from 12:42 to 4:14 am,bookMeeting
schedule meet,bookMeeting
setup available hall from 11:22 am to 4:03 am,bookMeeting
search some meet between 4:39 pm and 9:38 am,bookMeeting
setup meet from 5:44 to 9:04,bookMeeting
find all hall on 8 of jan,bookMeeting
schedule room from 10:29 pm to 2:50 am,bookMeeting
identify all available hall between 9:07 and 6:31,bookMeeting
show all available meeting between 12:00 pm and 14:06,bookMeeting
arrange any available meet,bookMeeting
setup any hall,bookMeeting
fix all available hall,bookMeeting
setup available meeting from 1:49 to 5:05 on 23 of apr,bookMeeting
arrange meeting from 6:29 pm to 2:26,bookMeeting
book available meeting from 2:19 pm to 9:9 am,bookMeeting
book some meeting,bookMeeting
fix available room from 6:47 pm to 7:24 pm on 19/9,bookMeeting
show me any room between 4:34 am and 11:25 am,bookMeeting
fix some meet,bookMeeting
schedule all available hall,bookMeeting
identify all available room between 6:59 pm and 2:23 am,bookMeeting
arrange some available room,bookMeeting
show any available meeting between 5:31 am and 2:04 pm,bookMeeting
fix all available room,bookMeeting
show me all available room on july 22,bookMeeting
fix meeting from 9 pm to 1:2 on jun 26th,bookMeeting
find all available room on September 14,bookMeeting
setup meeting from 2:25 pm to 7:01 pm,bookMeeting
show me all available room on 8/2,bookMeeting
identify some available meet on feb 8,bookMeeting
book any room,bookMeeting
identify meeting on oct 20,bookMeeting
look for any meeting between 12:40 and 4:6,bookMeeting
setup room from 2:14 to 5:03 am on October 8th,bookMeeting
schedule room from 0:12 pm to 8:23 am on 24/2,bookMeeting
show meeting between 11:5 am and 7:44,bookMeeting
look for available hall on oct 15th,bookMeeting
reserve available hall from 8:06 to 14:22,bookMeeting
show some available room,bookMeeting
look for all meeting between 9:40 and 10:8,bookMeeting
schedule meet from 12:29 to 3:30 am on oct 9,bookMeeting
fix meet from 7:27 am to 7:52 am,bookMeeting
book some available hall,bookMeeting
book available meeting from 9:22 pm to 21:40,bookMeeting
show some available room between 10:25 am and 7:16 pm,bookMeeting
identify room between 13:48 and 0:13,bookMeeting
search some available meet,bookMeeting
book room from 21:6 to 0:6 pm on 8/11,bookMeeting
show all meeting on mar 6th,bookMeeting
show me any available room on 26 of January,bookMeeting
fix meet from 21:25 to 1:26,bookMeeting
reserve hall,bookMeeting
show me all meet between 6:29 and 14:22,bookMeeting
fix hall from 1:28 am to 12:29,bookMeeting
identify any available meet between 7:8 am and 11:29 am,bookMeeting
find some meeting between 5:35 and 9:26 pm,bookMeeting
search all available room between 6:6 pm and 4:39,bookMeeting
identify all hall between 9:50 and 5:00 am,bookMeeting
show some room between 0:29 and 9:28 pm,bookMeeting
setup meet from 3:32 pm to 9:26 on 10 of apr,bookMeeting
search some hall between 2:54 am and 5:09 pm,bookMeeting
arrange available meet from 9:52 am to 18:05 on 20th of June,bookMeeting
fix available meet from 3:31 pm to 7:30 am on 16th of oct,bookMeeting
find some available hall,bookMeeting
fix available meeting from 5:41 to 18:14,bookMeeting
arrange available meet from 0:36 to 5:0 on 21th of july,bookMeeting
schedule available meet from 14:55 to 9:21 pm,bookMeeting
setup any available meeting,bookMeeting
setup available meeting from 21:09 to 0:43 am on 23 of feb,bookMeeting
look for all available meet on 30 of October,bookMeeting
fix any available meeting,bookMeeting
fix available room from 3:10 to 0:10 on 29/8,bookMeeting
reserve available meeting from 14:35 to 4:58 am on 8th of jan,bookMeeting
fix some available meeting,bookMeeting
arrange hall from 20:59 to 3:38 pm on 16/8,bookMeeting
identify some available meeting on 26/10,bookMeeting
arrange available meet from 0:55 to 3:23 pm,bookMeeting
look for all meeting between 5:3 am and 13:14,bookMeeting
show available meeting on 4 of July,bookMeeting
show me all available meet on jun 2nd,bookMeeting
find all available room between 23:43 and 1:20 am,bookMeeting
find available meet between 11:04 and 1:1,bookMeeting
fix available hall from 21:19 to 0:7 am,bookMeeting
identify all hall between 11:17 and 21:45,bookMeeting
book available meeting from 5:43 pm to 3:30 on 17 of jan,bookMeeting
reserve hall from 3:03 to 5:45,bookMeeting
setup hall from 9:49 to 5:38 am,bookMeeting
identify available meet on July 23th,bookMeeting
reserve meet from 3:31 pm to 10:12 on 13th of apr,bookMeeting
reserve any meet,bookMeeting
setup hall from 3:01 am to 12:0 pm,bookMeeting
reserve meeting from 13:47 to 5:16 am,bookMeeting
identify some available room between 11:14 and 22:0,bookMeeting
setup available meeting from 6:14 am to 8:00 pm on 2 of March,bookMeeting
fix hall from 1:38 to 9:10 am on aug 29th,bookMeeting
identify all available hall,bookMeeting
setup available room from 2:20 to 21:05 on May 30th,bookMeeting
find available meet between 19:34 and 6:09 pm,bookMeeting
show any available hall,bookMeeting
show me some meet between 8:2 pm and 10:39 pm,bookMeeting
reserve hall from 6:25 am to 7:45,bookMeeting
setup available meet from 11:2 to 22:13 on nov 9th,bookMeeting
setup meeting from 22:19 to 19:24 on August 17th,bookMeeting
show all meet on September 31th,bookMeeting
fix room,bookMeeting
schedule available hall,bookMeeting
find any available room between 0:2 and 6:29 pm,bookMeeting
show me any hall between 0:14 am and 11:46,bookMeeting
search any available meet between 11:54 am and 1:21,bookMeeting
fix meeting from 2:29 to 3:22 am on aug 25,bookMeeting
arrange available meeting from 7:05 to 2:29 pm on apr 13,bookMeeting
reserve available room from 3:22 to 0:52 on 24/3,bookMeeting
look for any available room on April 5,bookMeeting
show me some meet on March 29,bookMeeting
reserve any available meeting,bookMeeting
reserve available meet from 8:31 to 6:21 on June 10,bookMeeting
look for available meeting between 19:21 and 9:2 pm,bookMeeting
setup hall from 12:27 to 23:30,bookMeeting
schedule available room from 9:0 am to 9:24 am on may 7,bookMeeting
look for some meet on 30th of November,bookMeeting
arrange available meeting from 4:36 to 1:20 am,bookMeeting
book any available room,bookMeeting
find some meet on 20 of July,bookMeeting
find any available meeting between 7:10 am and 12:23,bookMeeting
show all available room on 13 of August,bookMeeting
search all available meet on 29 of May,bookMeeting
search any room on July 19th,bookMeeting
reserve available hall from 12:12 to 20:52 on 13th of February,bookMeeting
identify available meet between 2:33 and 9:51 am,bookMeeting
identify some meeting between 2:49 and 2:36 pm,bookMeeting
identify all available hall between 7:11 pm and 12:6,bookMeeting
schedule available meeting from 4:1 to 0:21,bookMeeting
setup meeting from 3:24 to 16:57 on July 30th,bookMeeting
look for available meet between 8:29 pm and 8:05,bookMeeting
find available meet on jan 28th,bookMeeting
look for all available meet on 7/3,bookMeeting
look for all available hall on 11th of may,bookMeeting
book hall from 5:35 am to 13:39,bookMeeting
schedule meet from 8:35 pm to 4:45,bookMeeting
book room from 21:23 to 13:9 on April 23,bookMeeting
search available meeting on 2 of oct,bookMeeting
reserve available room from 4:7 to 15:52,bookMeeting
setup available meeting from 5:13 pm to 1:37 pm,bookMeeting
fix meeting from 5:44 to 7:23 on July 18th,bookMeeting
search some available meet between 20:46 and 1:28,bookMeeting
show me any meet between 5:1 and 5:11 pm,bookMeeting
show any available room on 11 of July,bookMeeting
search available room on October 16th,bookMeeting
find any available meeting,bookMeeting
setup available meet from 22:44 to 2:14,bookMeeting
arrange available meeting from 1:48 am to 3:03 am,bookMeeting
identify any room on 28/6,bookMeeting
look for all room on 22th of December,bookMeeting
show me all available meeting on 6/10,bookMeeting
schedule available room from 5:2 to 1:15 on November 25th,bookMeeting
search all hall between 7:35 and 10:27 am,bookMeeting
show me all room on oct 5th,bookMeeting
show me all room on March 1st,bookMeeting
setup available meeting from 11:42 to 5:03 pm,bookMeeting
fix meet from 5:14 am to 2:59 pm,bookMeeting
schedule available meeting from 11:26 to 7:08 pm,bookMeeting
show me some available room on 9 of May,bookMeeting
look for any available hall on sept 13,bookMeeting
book available meeting from 15:27 to 16:02 on 2/6,bookMeeting
fix available meeting from 16:53 to 15:12,bookMeeting
reserve available meet,bookMeeting
find some meeting on December 10,bookMeeting
show me any available meeting on 26 of aug,bookMeeting
reserve meet from 4:00 pm to 9:52 am,bookMeeting
find all available meet on 18 of July,bookMeeting
arrange meeting from 11:47 am to 5:19 am,bookMeeting
identify some available meet between 1:02 and 12:54 am,bookMeeting
fix hall from 0:59 am to 15:45 on sept 22th,bookMeeting
setup meeting from 6:15 pm to 1:50,bookMeeting
look for some available meeting between 22:03 and 11:8,bookMeeting
look for some hall on 21th of jun,bookMeeting
search any available room on August 5th,bookMeeting
search some available meet on 23th of January,bookMeeting
setup meet from 1:13 pm to 19:55 on mar 16,bookMeeting
reserve room,bookMeeting
reserve any available hall,bookMeeting
book available meeting from 0:50 to 8:05 am on jun 3rd,bookMeeting
schedule available meeting from 7 to 6:5 on 19/9,bookMeeting
arrange room from 2:09 to 6:7,bookMeeting
search available meet between 17:33 and 8:16 pm,bookMeeting
show me some meeting between 4:25 am and 12:25,bookMeeting
reserve available meet from 18:43 to 8:53,bookMeeting
book hall from 9:29 am to 3:21 am,bookMeeting
reserve all available meet,bookMeeting
book hall from 0:04 pm to 19:18,bookMeeting
identify available hall on 6 of apr,bookMeeting
book available room from 7:59 to 7:17,bookMeeting
arrange room from 0:7 to 6:35 am,bookMeeting
search meeting on 21th of September,bookMeeting
reserve available meet from 19:32 to 2:27 pm,bookMeeting
setup available meeting from 1:20 to 10:18 am,bookMeeting
find all meet between 0:7 and 9:40,bookMeeting
fix room from 0:29 pm to 7:26 on 11th of aug,bookMeeting
reserve meeting from 1:35 am to 2:10,bookMeeting
identify any available hall on oct 17th,bookMeeting
find available meet on May 12th,bookMeeting
reserve room from 11:08 am to 12:24 pm on December 31th,bookMeeting
search all hall between 19:03 and 1:44,bookMeeting
schedule hall from 10:48 to 16:08,bookMeeting
show me any available meeting between 3:30 pm and 8:12,bookMeeting
fix available hall from 1:14 pm to 0:49,bookMeeting
setup room from 1:4 to 4:6,bookMeeting
find all meet between 10:02 pm and 19:09,bookMeeting
reserve available meeting from 6:14 to 5:07 on 15/7,bookMeeting
schedule available meeting from 6:36 to 10:7 am on 15 of August,bookMeeting
book meet from 2:00 am to 17:01 on 17/5,bookMeeting
identify available meet on February 18,bookMeeting
identify any hall on 9 of February,bookMeeting
search any available hall on 22 of nov,bookMeeting
find some room on 19th of jun,bookMeeting
show some hall on mar 19,bookMeeting
schedule available room from 8:6 pm to 2:5 am on 9 of feb,bookMeeting
schedule available hall from 9:59 to 8:17,bookMeeting
find some meeting on 24th of nov,bookMeeting
reserve meet from 15:46 to 21:55 on 28th of May,bookMeeting
setup some room,bookMeeting
schedule meet from 8:58 pm to 5:4 pm on 4 of October,bookMeeting
schedule available room from 1:15 pm to 9:5 am,bookMeeting
search any available meeting between 13:42 and 11:19 pm,bookMeeting
identify meet on jun 21th,bookMeeting
book room from 9:3 to 8:10 pm on 5/5,bookMeeting
setup available meeting from 6:19 pm to 6:44 pm on November 1,bookMeeting
arrange available meeting from 0:05 pm to 3:14 am on February 11th,bookMeeting
arrange meeting from 3:3 pm to 9:53 on 17th of nov,bookMeeting
show me any available meeting on 30th of June,bookMeeting
find some meet between 20:00 and 0:30,bookMeeting
show all hall on 7 of dec,bookMeeting
find any room on 24 of may,bookMeeting
reserve available meeting from 22:09 to 0:15,bookMeeting
show meet on 23/5,bookMeeting
search available meeting on jun 22,bookMeeting
search any available hall on February 29th,bookMeeting
reserve available room from 0:55 pm to 23:1,bookMeeting
schedule available room from 23:29 to 2:59 on feb 28,bookMeeting
setup meet from 4:04 to 11:35 on nov 8th,bookMeeting
book available room from 15:2 to 1:17 am on 25th of july,bookMeeting
show meeting between 7:32 am and 2:13,bookMeeting
search any meeting between 3:42 and 18:09,bookMeeting
show me all hall between 11:43 am and 10:24,bookMeeting
book available meeting from 21:5 to 7:08 pm on 31th of dec,bookMeeting
schedule available room from 2:54 to 3:45,bookMeeting
fix available hall from 17:23 to 5:22,bookMeeting
reserve available meeting from 8:26 to 6:09 on mar 1,bookMeeting
reserve meeting from 6:20 pm to 1:8,bookMeeting
fix available meeting from 20:2 to 4:04,bookMeeting
book meet from 10:7 pm to 13:49 on 6th of September,bookMeeting
find all hall between 2:2 pm and 2:16 am,bookMeeting
book meet from 8:23 to 11:7 am on 6 of july,bookMeeting
fix meeting from 15:38 to 16:0,bookMeeting
reserve available hall from 8:0 to 6:43 pm,bookMeeting
look for some available hall between 17:08 and 4:45,bookMeeting
arrange room from 12:53 to 7:9 am on 19 of nov,bookMeeting
look for all meeting between 11:28 am and 7:40 pm,bookMeeting
show me some available room on 30 of May,bookMeeting
show room on 16 of February,bookMeeting
find some available hall between 11:20 and 4:45 am,bookMeeting
reserve meet from 0:17 am to 8:21,bookMeeting
show me some available hall between 7:6 and 6:56 pm,bookMeeting
schedule available hall from 0:6 am to 4:52 on jun 13th,bookMeeting
arrange meeting from 9:26 pm to 7:50,bookMeeting
setup available meeting from 4:9 am to 10:6 am on June 13,bookMeeting
book meeting from 8:52 to 0:27 am on jan 6,bookMeeting
identify some available meeting between 9:4 and 4:5,bookMeeting
show me all available hall on may 13,bookMeeting
identify any meeting on April 18,bookMeeting
setup meet from 2:22 pm to 2:22 pm,bookMeeting
setup meet from 1:7 am to 7:27 am,bookMeeting
find available meet on feb 8,bookMeeting
reserve hall from 0:29 to 6:7,bookMeeting
show all hall on oct 4,bookMeeting
fix available meet from 0:20 to 3:09 am,bookMeeting
identify some available meet on 18 of july,bookMeeting
book available room from 5:34 to 2:07,bookMeeting
look for any available meet between 4:58 am and 11:17 am,bookMeeting
fix meeting from 7:10 to 6:8,bookMeeting
setup room from 1:52 pm to 4:01 pm on January 5,bookMeeting
book all available hall,bookMeeting
show available hall between 11:39 and 15:13,bookMeeting
identify any available meeting between 18:9 and 4:3,bookMeeting
fix meet from 4:14 to 11:19,bookMeeting
show some room on 28 of November,bookMeeting
show me any available room on 28 of jun,bookMeeting
arrange available meet from 22:17 to 23:59,bookMeeting
show me meet on 19/8,bookMeeting
reserve meet from 3:8 to 1:16 pm on 8 of feb,bookMeeting
fix meet from 10:23 to 12:02 pm,bookMeeting
find some meeting between 1:32 pm and 16:21,bookMeeting
arrange meeting from 0:43 am to 10:34 pm,bookMeeting
identify some meet between 16:43 and 6:58,bookMeeting
identify some meet between 2:51 and 0:59,bookMeeting
show some meeting on 28/7,bookMeeting
fix available room from 3:36 to 21:34,bookMeeting
show me all available meeting between 15:39 and 11:57 am,bookMeeting
look for all meet between 4:24 am and 3:52 am,bookMeeting
reserve hall from 2:54 pm to 4:38,bookMeeting
setup available meet from 12:26 am to 5:23 am,bookMeeting
fix hall from 11:45 am to 6:29 am on 16 of sept,bookMeeting
reserve available hall from 20:07 to 1:23,bookMeeting
find some room between 13:37 and 0:45,bookMeeting
schedule available meet from 1:41 to 10:54 pm on 20 of sept,bookMeeting
book meet from 0:12 am to 0:1,bookMeeting
show me all hall between 6:39 and 11:04,bookMeeting
arrange meeting from 1:04 to 3:08 on May 11th,bookMeeting
find all meet between 21:12 and 4:38 pm,bookMeeting
show me available meeting between 8:39 and 9:57,bookMeeting
look for all available meeting on November 2nd,bookMeeting
fix available hall from 15:1 to 0:56 on 16th of mar,bookMeeting
book room from 6:45 to 1:7 am,bookMeeting
book meet from 21:38 to 8:06,bookMeeting
book hall from 5:24 to 13:45 on December 9th,bookMeeting
setup room from 0:50 am to 6:00 am on aug 24th,bookMeeting
fix some available hall,bookMeeting
identify all meet between 10:07 am and 1:29 pm,bookMeeting
fix meet from 3:58 pm to 3:6 am,bookMeeting
identify meet on September 20,bookMeeting
book meeting from 10:2 to 8:51 on next Fri,bookMeeting
identify some available hall between 10:37 pm and 5:43 pm,bookMeeting
setup available hall,bookMeeting
arrange available room from 11:5 am to 3:49 am on October 7,bookMeeting
setup available room from 11:51 to 23:23,bookMeeting
show me available meet on 17 of February,bookMeeting
setup available hall from 6:27 to 8:01,bookMeeting
show some hall between 6:40 am and 20:10,bookMeeting
search some available meet between 9:29 and 9:05 am,bookMeeting
arrange all available hall,bookMeeting
setup available meeting from 7:54 to 7:7,bookMeeting
show hall on 14 of June,bookMeeting
find any meet between 9:05 and 14:41,bookMeeting
arrange meeting from 16:28 to 11:10 on 10th of aug,bookMeeting
arrange room from 15:9 to 5:19 pm on 26 of aug,bookMeeting
book room from 9:5 am to 11:41 on jun 30,bookMeeting
arrange available meeting from 10:14 am to 7:26 on 4 of September,bookMeeting
arrange available meet from 11:11 am to 3:56 am on 21th of February,bookMeeting
setup available meeting from 22:1 to 16:53,bookMeeting
setup available meeting from 17:45 to 14:18 on 29 of jun,bookMeeting
book available hall from 14:59 to 0:46 pm,bookMeeting
look for some available hall between 20:07 and 5:52 pm,bookMeeting
reserve available meeting from 12:2 to 3:02 on 10th of may,bookMeeting
reserve hall from 12:49 pm to 10:26 am,bookMeeting
fix available meeting from 10:19 pm to 1:45 am on 27/12,bookMeeting
arrange available hall from 8:03 am to 10:45 am on may 7th,bookMeeting
book meeting from 17:59 to 7:4 am,bookMeeting
book meet from 6:49 to 2:25 pm,bookMeeting
look for available room between 18:39 and 4:55 am,bookMeeting
schedule available meet from 15:20 to 6:13,bookMeeting
search room on 15/11,bookMeeting
arrange hall from 11:13 to 20:32 on 21/11,bookMeeting
book available hall from 7:7 pm to 18:14 on January 23,bookMeeting
