data,intent
schedule available meeting from 5:44 pm to 5:34 am on may 27th,bookMeeting
reserve available meet from 0:00 am to 10:41,bookMeeting
identify some available meet between 4:54 pm and 14:50,bookMeeting
fix meeting from 2:6 to 0:03,bookMeeting
show me hall between 17:34 and 7:56,bookMeeting
look for meeting on 27 of nov,bookMeeting
show all available meeting between 0:51 pm and 12:12 pm,bookMeeting
look for any meeting between 6:38 pm and 6:58 pm,bookMeeting
show room on March 11th,bookMeeting
setup hall from 13:43 to 1:22 pm,bookMeeting
setup room from 11:02 to 3:43 on April 31,bookMeeting
arrange available room from 1:19 pm to 6:59 am,bookMeeting
show me any available meet between 7:27 am and 7:55,bookMeeting
schedule meeting from 9:35 pm to 2:02 on 4th of December,bookMeeting
fix available room from 4:44 am to 8:31 on 3rd of nov,bookMeeting
setup meeting from 1:02 to 6:56 am on 12th of November,bookMeeting
fix available meeting from 6:51 to 8:34,bookMeeting
setup available room from 7:59 am to 7:07 am on 23th of July,bookMeeting
arrange available room from 4:24 to 6:00 am,bookMeeting
fix available meeting from 11:21 to 0:6 am,bookMeeting
setup available meet from 10:02 pm to 1:26,bookMeeting
arrange available hall from 3:5 to 10:43 pm,bookMeeting
identify some meeting on 28/2,bookMeeting
book available meeting from 0:13 pm to 8:47 am on 12th of February,bookMeeting
show available meet between 5:47 am and 4:2 am,bookMeeting
book available hall from 0:01 am to 11:28 pm,bookMeeting
look for any available meeting between 0:13 am and 14:25,bookMeeting
book meeting from 5:09 to 3:0 pm on 10 of mar,bookMeeting
find some meeting on 17th of dec,bookMeeting
setup hall from 8:9 to 6:51,bookMeeting
identify available meet between 2:30 am and 12:23,bookMeeting
schedule room from 8:44 pm to 11:13 pm,bookMeeting
look for meeting on August 16th,bookMeeting
look for all meeting on apr 6th,bookMeeting
fix available room from 8:16 to 14:04 on 30 of February,bookMeeting
find all available meeting between 7:26 am and 11:18 pm,bookMeeting
identify some available meeting between 10:34 and 12:31,bookMeeting
look for any meeting on sept 6,bookMeeting
identify some hall between 15:16 and 3:56 pm,bookMeeting
fix available meet from 22:0 to 8:8 pm on 27/5,bookMeeting
setup available hall from 21:6 to 11:19 pm on 20/3,bookMeeting
look for any meeting on 6 of October,bookMeeting
fix meet from 13:48 to 3:38 on 2/12,bookMeeting
fix available meeting from 7:25 pm to 0:49 am,bookMeeting
identify available room on oct 27,bookMeeting
show all available room on 18th of jun,bookMeeting
fix hall from 2:08 to 16:14 on October 19,bookMeeting
find available meet on 14 of july,bookMeeting
schedule meeting from 7:48 to 22:42,bookMeeting
schedule available meeting from 8:14 to 9:04,bookMeeting
fix meeting from 9 pm to 8:34 am,bookMeeting
arrange meeting from 12:53 to 22:27,bookMeeting
look for any meeting on sept 10th,bookMeeting
look for any hall on oct 23th,bookMeeting
find all available hall on 22 of October,bookMeeting
schedule available hall from 0:49 to 7:42 pm,bookMeeting
book room from 1:20 pm to 1:45,bookMeeting
schedule room from 15:51 to 5:29 on aug 5th,bookMeeting
setup available meet from 8:17 am to 3:08,bookMeeting
fix available meeting from 0:03 to 6:08 on October 27,bookMeeting
book available meeting from 21:18 to 9:3 on 14 of jun,bookMeeting
reserve available meeting from 19:38 to 5:26 am,bookMeeting
arrange available hall from 6:34 am to 12:27 am,bookMeeting
fix available hall from 8:17 to 5:19,bookMeeting
book available room from 10:28 to 8:37 on 27/6,bookMeeting
identify some available meet,bookMeeting
setup available meet from 4:52 am to 2:15,bookMeeting
book meeting from 11:8 pm to 8:40 am,bookMeeting
look for any available hall between 3:35 pm and 12:58,bookMeeting
reserve available meet from 5:6 pm to 5:25,bookMeeting
show all hall between 10:50 and 21:32,bookMeeting
reserve available meeting from 12:1 am to 12:17 pm,bookMeeting
book hall from 10:40 pm to 4:22,bookMeeting
look for some meet between 4:20 and 2:8,bookMeeting
arrange available meeting from 8:26 pm to 17:4,bookMeeting
identify all available room between 0:49 and 6:23 pm,bookMeeting
book available meet from 8:41 am to 10:4,bookMeeting
arrange available meet from 5:05 pm to 0:13 pm,bookMeeting
arrange hall from 8:00 to 2:16 am on feb 25th,bookMeeting
find any available hall between 1:1 and 8:35 am,bookMeeting
search any hall on oct 1st,bookMeeting
fix meet from 10:30 to 4:13,bookMeeting
reserve any meeting,bookMeeting
reserve available meet from 2:07 pm to 7:21,bookMeeting
book any available meeting,bookMeeting
look for any meeting between 18:04 and 3:23,bookMeeting
show some meeting on November 6th,bookMeeting
show all meeting on 21/7,bookMeeting
schedule meeting from 12:41 to 1:1 pm,bookMeeting
search some room between 1:29 pm and 9:45,bookMeeting
identify any available hall on 24/8,bookMeeting
book available meeting from 6:19 to 20:21,bookMeeting
find any available room on 7th of nov,bookMeeting
arrange meet,bookMeeting
identify hall between 2:30 and 18:5,bookMeeting
arrange available room,bookMeeting
schedule room from 7:27 pm to 3:2 pm,bookMeeting
schedule available meeting from 4:12 am to 8:51,bookMeeting
fix available hall from 19:30 to 6:39 on April 20,bookMeeting
search all available meet on 6 of May,bookMeeting
book meet from 1:22 to 9:07,bookMeeting
reserve room from 11:01 am to 12:27 am on February 29,bookMeeting
fix meet from 10:06 pm to 3:03 am,bookMeeting
show me some available room between 9:32 pm and 7:29 am,bookMeeting
find all hall between 10:42 and 3:12 am,bookMeeting
show meeting between 10:33 pm and 8:59 pm,bookMeeting
book available room from 7:08 to 23:04,bookMeeting
identify all meet on 31th of June,bookMeeting
look for any available room between 11:27 and 7:40,bookMeeting
find all hall between 3:07 and 3:35,bookMeeting
setup available hall from 6:17 to 17:06 on November 9th,bookMeeting
arrange room,bookMeeting
arrange available room from 15:10 to 18:18,bookMeeting
show available room on next Wednesday,bookMeeting
hello pls me need get for paternity vacation on mar 11th,applyLeave
hi pls I need request for paternity take work off on aug 16,applyLeave
hi plz need avail for holiday,applyLeave
pls wish avail for vacation,applyLeave
hi plz me wish request for maternity take work off on 22th of July,applyLeave
hey plz want get for leave,applyLeave
application maternity leave,applyLeave
plz me need request for earned holiday,applyLeave
hi pls get for leave on 6th of November,applyLeave
request for maternity holiday,applyLeave
hi please me need application for maternity holiday on 15 of mar,applyLeave
hey please I wish application for earned leave,applyLeave
hey plz me want application for sick take work off on May 12,applyLeave
hello pls me request apply for maternity holiday on 18 of feb,applyLeave
plz wish avail for medical holiday on oct 4,applyLeave
request take work off,applyLeave
hi pls me need avail for earned holiday on sept 4,applyLeave
hello pls I want apply for sick holiday on 29th of January,applyLeave
hey I request application for medical vacation,applyLeave
hello pls me get for casual holiday on 4th of September,applyLeave
hello I need request for sick vacation on 23 of aug,applyLeave
hello me request apply for earned holiday,applyLeave
hello I apply for paternity take work off,applyLeave
hey please me need apply for maternity holiday on dec 23th,applyLeave
hello me want get for maternity take work off on 2nd of March,applyLeave
hi plz me want avail for maternity take work off,applyLeave
hey pls I want apply for earned take work off on October 19,applyLeave
hello me wish request for medical take work off on 20th of aug,applyLeave
pls me request for medical holiday on 30th of mar,applyLeave
request sick leave,applyLeave
I need avail for paternity holiday,applyLeave
hey pls wish avail for sick take work off,applyLeave
hello pls request request for earned leave,applyLeave
get for sick holiday,applyLeave
hey plz I wish application for paternity take work off on 31th of October,applyLeave
request sick holiday,applyLeave
hi plz I request avail for casual leave on December 17th,applyLeave
pls me need request for paternity vacation,applyLeave
hello plz I want avail for medical leave on November 12th,applyLeave
hi plz me wish avail for paternity leave,applyLeave
me application for earned take work off,applyLeave
I need request for earned leave,applyLeave
avail casual holiday,applyLeave
hello please me want application for leave on September 3rd,applyLeave
hello plz I wish get for medical vacation,applyLeave
hey plz me request for earned holiday on sept 18th,applyLeave
hey please me need apply for maternity leave,applyLeave
hey pls I want apply for maternity holiday on may 16,applyLeave
please me request for take work off,applyLeave
hello plz me apply for maternity holiday,applyLeave
hey pls I want avail for casual vacation,applyLeave
I get for casual holiday,applyLeave
hey request get for maternity holiday on oct 5,applyLeave
hi me apply for maternity leave,applyLeave
avail earned holiday,applyLeave
hi please request avail for leave on 5th of dec,applyLeave
request medical vacation,applyLeave
hey please me need request for paternity take work off,applyLeave
hello pls I apply for maternity holiday on sept 4th,applyLeave
hello plz me need apply for casual leave on 2 of july,applyLeave
plz I need apply for paternity holiday,applyLeave
hey please me need request for casual leave on apr 16,applyLeave
hello please want apply for earned holiday,applyLeave
hi pls I need apply for medical vacation on June 17,applyLeave
plz I want avail for take work off,applyLeave
me wish request for vacation,applyLeave
get leave,applyLeave
I request for leave,applyLeave
hi plz request for leave on jun 24,applyLeave
hello pls need avail for leave on apr 16,applyLeave
hey plz me need avail for medical take work off,applyLeave
pls me need application for casual take work off,applyLeave
hey plz me wish get for casual vacation on 12 of nov,applyLeave
hey pls want get for medical leave,applyLeave
hey please I want get for medical take work off on 3rd of jan,applyLeave
I request for earned holiday on 15th of july,applyLeave
hi request for earned holiday,applyLeave
hello please request avail for casual take work off on 31 of apr,applyLeave
want request for sick leave on April 16th,applyLeave
I need apply for maternity vacation on 2/9,applyLeave
hey plz wish get for paternity take work off,applyLeave
hi pls me wish request for leave,applyLeave
hello plz I wish request for paternity vacation,applyLeave
hi need apply for maternity holiday on aug 14,applyLeave
hey plz me need application for earned holiday on 15 of September,applyLeave
hi please I wish request for paternity leave on 19th of September,applyLeave
hey plz I request apply for casual leave,applyLeave
request paternity vacation,applyLeave
hi plz request avail for medical leave,applyLeave
avail maternity holiday,applyLeave
hi plz me request get for sick vacation,applyLeave
hey me wish get for maternity leave on 9/3,applyLeave
hi pls I request request for holiday on 31 of April,applyLeave
hello plz me wish get for casual vacation,applyLeave
hello plz me request for casual leave,applyLeave
hi please want application for medical holiday on 9/6,applyLeave
pls want get for holiday on May 26,applyLeave
want apply for casual holiday on May 27,applyLeave
hey pls want avail for paternity take work off on 14th of mar,applyLeave
hello want apply for holiday on 2 of May,applyLeave
hello please I need application for medical holiday on dec 9th,applyLeave
hey plz me request get for medical leave on 18th of March,applyLeave
me want application for paternity leave,applyLeave
I get for casual holiday on 5th of oct,applyLeave
hey pls wish apply for casual take work off on 6 of March,applyLeave
pls I want application for earned leave,applyLeave
hi plz me application for maternity leave,applyLeave
apply casual leave,applyLeave
plz me need application for medical take work off,applyLeave
hello plz wish apply for paternity vacation,applyLeave
hey please me need apply for medical take work off on 20th of November,applyLeave
hello plz I need apply for paternity take work off on 28 of july,applyLeave
hi plz me need get for casual take work off on 4 of aug,applyLeave
hi please wish application for earned take work off,applyLeave
hi plz I request request for earned leave,applyLeave
hello pls me request avail for medical take work off on jan 1,applyLeave
pls I want avail for paternity take work off on September 16th,applyLeave
hi plz me want apply for earned leave on 7th of November,applyLeave
hello I request avail for paternity leave,applyLeave
hello please me want application for sick take work off on may 9,applyLeave
hi I request application for medical leave on December 27th,applyLeave
hey please need application for sick vacation on 20th of June,applyLeave
hello please me wish request for maternity leave,applyLeave
plz me request for leave on April 20,applyLeave
hello please me request request for leave on 15th of feb,applyLeave
hey please me want request for earned holiday on 25/8,applyLeave
avail take work off,applyLeave
please I want avail for earned leave on February 11th,applyLeave
hey plz me need apply for earned take work off on jan 6,applyLeave
pls I want request for medical take work off,applyLeave
hey pls me request for casual take work off,applyLeave
hello pls me want get for sick holiday on nov 10,applyLeave
request for maternity leave,applyLeave
hello pls me get for sick take work off on 23th of apr,applyLeave
pls I request for holiday,applyLeave
hey pls application for medical holiday on 5 of mar,applyLeave
hello me want apply for holiday,applyLeave
hi plz request apply for sick take work off,applyLeave
plz me application for maternity holiday,applyLeave
hi please request for medical take work off,applyLeave
hello plz want get for casual take work off,applyLeave
please request apply for paternity leave on 9th of March,applyLeave
plz me want application for casual leave on December 28th,applyLeave
hey pls I wish application for earned holiday on February 9,applyLeave
hey I request get for sick take work off,applyLeave
hello pls I wish avail for earned leave on 14 of feb,applyLeave
hello plz I application for paternity holiday on oct 20,applyLeave
pls wish application for sick vacation,applyLeave
please I request application for casual holiday on may 24,applyLeave
hello plz request avail for paternity take work off,applyLeave
hello pls request avail for leave,applyLeave
avail casual leave,applyLeave
hi please I request get for paternity take work off,applyLeave
hi plz I want avail for paternity leave on May 18th,applyLeave
request sick take work off,applyLeave
pls I need get for sick holiday on mar 13,applyLeave
hi pls I request get for casual take work off on May 21,applyLeave
hello wish avail for paternity take work off on 6/1,applyLeave
hi pls need apply for take work off on 12th of mar,applyLeave
hi please apply for casual vacation on nov 9,applyLeave
hi plz I request apply for earned vacation,applyLeave
hi please I want application for earned vacation,applyLeave
hi plz wish application for leave on May 29,applyLeave
hey pls avail for earned holiday on 26 of March,applyLeave
hi pls need apply for sick leave,applyLeave
application casual vacation,applyLeave
hi me request application for sick vacation,applyLeave
hello pls me need request for sick take work off on 18/3,applyLeave
please I want get for paternity leave,applyLeave
hello plz I want request for maternity vacation on January 2,applyLeave
please I request apply for paternity take work off,applyLeave
please me avail for paternity take work off,applyLeave
plz request apply for casual take work off,applyLeave
avail medical holiday,applyLeave
hi plz want apply for sick leave,applyLeave
hey request avail for medical take work off,applyLeave
hi application for paternity leave,applyLeave
hello please I request request for sick vacation on 26 of October,applyLeave
hey pls me want apply for medical leave on 17th of feb,applyLeave
hey pls I wish get for paternity holiday,applyLeave
hi please I want avail for earned holiday,applyLeave
hi pls request get for medical take work off,applyLeave
hey please wish application for paternity vacation,applyLeave
hey plz I wish avail for sick vacation,applyLeave
hey I need avail for earned leave,applyLeave
plz get for medical vacation on jan 31,applyLeave
hey please I need get for medical take work off,applyLeave
hey please wish get for medical vacation,applyLeave
plz I wish apply for sick leave on 15/7,applyLeave
hey plz I want get for medical vacation on 8th of mar,applyLeave
get maternity vacation,applyLeave
hi pls want apply for maternity take work off,applyLeave
hello me request get for paternity leave,applyLeave
hey I need request for casual holiday,applyLeave
please need avail for maternity leave,applyLeave
I need get for casual vacation,applyLeave
hello me apply for sick take work off,applyLeave
hi please me wish get for medical take work off on 16th of February,applyLeave
pls me apply for medical vacation,applyLeave
pls me request for medical leave,applyLeave
plz I need get for medical holiday,applyLeave
hello plz me request apply for sick vacation,applyLeave
hello plz me wish apply for maternity take work off,applyLeave
hi plz I request get for sick holiday,applyLeave
hi please I need application for sick leave,applyLeave
hey plz me apply for sick leave on jan 5,applyLeave
please wish application for earned vacation,applyLeave
hello please me application for maternity take work off on next Sun,applyLeave
hello pls avail for maternity holiday on jan 20th,applyLeave
me request avail for sick holiday,applyLeave
hello plz me want avail for casual holiday on oct 5,applyLeave
hello pls I application for earned take work off on 1 of jan,applyLeave
hey please I application for casual leave on 14/6,applyLeave
hello pls I avail for casual leave on March 13,applyLeave
get vacation,applyLeave
hey please me want application for maternity leave on 30th of july,applyLeave
hello pls I request application for earned holiday,applyLeave
request for earned take work off,applyLeave
plz want application for earned take work off on 24 of mar,applyLeave
hello plz me wish apply for paternity vacation,applyLeave
please I request get for earned leave,applyLeave
hey please want avail for casual vacation on 20 of April,applyLeave
hey me want apply for medical leave,applyLeave
me want apply for vacation on 2nd of apr,applyLeave
request casual holiday,applyLeave
hello please I request avail for sick leave on 8 of jan,applyLeave
apply earned holiday,applyLeave
get paternity leave,applyLeave
hey plz wish application for maternity vacation,applyLeave
holiday,applyLeave
hi please me request get for paternity holiday on 9 of July,applyLeave
hey pls I wish apply for sick leave,applyLeave
please me request avail for medical vacation,applyLeave
hey please me wish application for paternity take work off on March 25th,applyLeave
plz I want application for earned leave on 30 of nov,applyLeave
pls me want get for holiday on 18th of July,applyLeave
medical take work off,applyLeave
hi me need request for holiday on 14th of nov,applyLeave
hi pls me request get for leave on 10/5,applyLeave
avail medical leave,applyLeave
hello wish avail for casual take work off,applyLeave
hey plz want application for sick take work off,applyLeave
hi request get for sick vacation,applyLeave
hi pls me request for paternity holiday,applyLeave
please wish avail for sick take work off on 6/4,applyLeave
pls I request avail for paternity leave,applyLeave
sick holiday,applyLeave
hi please me request application for maternity leave,applyLeave
hi please me wish avail for medical vacation,applyLeave
hello please want apply for paternity holiday on dec 1st,applyLeave
hi please I request avail for sick leave,applyLeave
plz me application for earned vacation,applyLeave
hello plz I apply for paternity holiday,applyLeave
plz request apply for sick take work off on 26th of mar,applyLeave
hi plz I want request for maternity take work off,applyLeave
pls application for paternity vacation,applyLeave
hi plz wish request for take work off on 27th of April,applyLeave
hey I request application for medical holiday,applyLeave
hello pls I wish application for maternity holiday,applyLeave
hello plz me request request for paternity leave on sept 15,applyLeave
hello pls want application for sick holiday on 12 of June,applyLeave
get paternity vacation,applyLeave
hello pls request application for take work off,applyLeave
hey want apply for sick vacation on 23 of may,applyLeave
hi please I wish get for sick take work off,applyLeave
hello plz me wish avail for leave on oct 6,applyLeave
hello pls I want get for casual holiday on 27 of March,applyLeave
hi please I wish apply for sick leave on August 22th,applyLeave
hey pls me avail for maternity holiday on 14th of October,applyLeave
hello pls avail for holiday,applyLeave
plz me apply for earned vacation,applyLeave
hey want avail for earned holiday,applyLeave
plz wish avail for earned leave,applyLeave
me want application for medical vacation,applyLeave
plz request avail for sick holiday,applyLeave
hi plz me want avail for maternity holiday on 18 of July,applyLeave
hello me request apply for paternity leave on October 24th,applyLeave
hi pls wish apply for holiday on dec 24th,applyLeave
hey me need apply for medical holiday,applyLeave
hi plz I want avail for paternity vacation,applyLeave
hello I wish avail for medical vacation on apr 5th,applyLeave
hi me request request for casual take work off,applyLeave
plz me avail for medical vacation,applyLeave
hi please I need avail for medical leave on oct 14,applyLeave
hey pls request request for medical vacation,applyLeave
hi plz I request application for casual take work off on 29 of October,applyLeave
hi please me get for earned take work off,applyLeave
please me request apply for take work off,applyLeave
plz me request avail for paternity take work off on jan 12,applyLeave
hi please me request avail for casual leave on September 8,applyLeave
hey please I want avail for earned leave on dec 4th,applyLeave
hey plz wish request for casual take work off,applyLeave
hey please want request for sick holiday,applyLeave
hey I want avail for paternity leave on May 25th,applyLeave
hello pls me request apply for earned holiday on 10th of sept,applyLeave
hey plz me need apply for casual holiday,applyLeave
me wish avail for paternity vacation on 15/6,applyLeave
please me get for medical holiday on 25 of sept,applyLeave
please want avail for casual leave on 18/7,applyLeave
please me request get for vacation on 18th of feb,applyLeave
hello pls wish application for maternity vacation on January 23th,applyLeave
application casual holiday,applyLeave
hello please wish request for take work off,applyLeave
hi wish request for sick holiday on 21/5,applyLeave
plz request application for sick take work off,applyLeave
hey want avail for casual holiday,applyLeave
hello plz me need get for earned vacation on 28 of October,applyLeave
hello please need get for casual take work off on 19th of may,applyLeave
plz I request application for paternity take work off on 27 of jan,applyLeave
I want apply for medical take work off,applyLeave
hi pls request for earned leave on January 4th,applyLeave
hi I need get for casual holiday,applyLeave
apply leave,applyLeave
hello please I want request for sick holiday on jun 18th,applyLeave
hi pls I want avail for sick leave,applyLeave
hello I want apply for maternity take work off,applyLeave
hello me want apply for maternity vacation on mar 7th,applyLeave
hi me want avail for paternity leave on 15 of September,applyLeave
hey pls want avail for earned holiday,applyLeave
hey pls I wish get for take work off on 9th of February,applyLeave
hi pls need avail for sick vacation on 24th of july,applyLeave
get medical leave,applyLeave
hi please me request avail for earned holiday,applyLeave
hello please I need get for earned take work off on 11 of January,applyLeave
hey me want avail for earned holiday,applyLeave
hello need get for maternity take work off,applyLeave
get earned holiday,applyLeave
hi plz wish avail for take work off on may 18th,applyLeave
hello plz me want application for medical holiday,applyLeave
hello plz I want application for medical vacation,applyLeave
plz wish apply for earned leave,applyLeave
pls me request get for medical vacation on 15 of July,applyLeave
hi please I request avail for paternity leave,applyLeave
I request get for casual leave,applyLeave
avail for casual leave on 19 of February,applyLeave
hey plz me request avail for earned take work off on july 28th,applyLeave
application vacation,applyLeave
hey pls want apply for paternity leave on October 24,applyLeave
hello I request avail for casual take work off on july 13th,applyLeave
hello I want avail for vacation on July 15th,applyLeave
hi need application for medical holiday,applyLeave
hello me want avail for casual holiday,applyLeave
pls want application for casual leave on 26 of April,applyLeave
hello please me want get for maternity holiday on 11 of nov,applyLeave
hello pls application for casual vacation on 1st of September,applyLeave
hello me application for leave,applyLeave
hi plz avail for maternity holiday on March 13,applyLeave
hello pls I wish get for medical vacation,applyLeave
